<?xml version="1.0" encoding="UTF-8"?>
<cifp xmlns:xsi="http://www.w3.org/2001/XMLSchema-instance"
      xsi:noNamespaceSchemaLocation="cifp.xsd">
    
    <alumne id="202">
        <nom>Pere</nom>
        <llinatges>Martorell</llinatges>
        <data_matricula>12-09-2023</data_matricula>
        <curs>ASIX</curs>
    </alumne>

    <professor id="890">
        <nom>Laura</nom>
        <llinatges>Vidal</llinatges>
        <correu>laura.vidal@paucasesnoves.cat</correu>
        <data_incorporació>01-09-2020</data_incorporació>
        <departament>Automoció</departament>
        <assignatura id_assignatura="33">
            <nom_assignatura cicle="AUT">Motors Tèrmics</nom_assignatura>
            <data_inici>15-09-2023</data_inici>
        </assignatura>
    </professor>
</cifp>